{
  "$ref": "#/definitions/blocks",
  "definitions": {
    "blocks": {
      "type": "object",
      "properties": {
        "name": {
          "type": "string"
        },
        "componentName": {
          "type": "string"
        },
        "orderId": {
          "type": "number"
        },
        "title": {
          "type": "string"
        },
        "subtitle": {
          "type": "string"
        },
        "media": {
          "type": "string"
        },
        "ctaText": {
          "type": "string"
        },
        "ctaLink": {
          "type": "string"
        },
        "secondaryCtaText": {
          "type": "string"
        },
        "secondaryCtaLink": {
          "type": "string"
        },
        "checklists": {
          "type": "string"
        },
        "$schema": {
          "type": "string"
        }
      },
      "additionalProperties": false
    }
  },
  "$schema": "http://json-schema.org/draft-07/schema#"
}