{
  "name": "hello-",
  "componentName": "Hero",
  "orderId": 1,
  "title": "I’m Kris",
  "subtitle": "Building intelligent web applications and digital workspaces to accelerate academic research and data management.",
  "media": "",
  "ctaText": "",
  "ctaLink": "",
  "secondaryCtaText": "",
  "secondaryCtaLink": "",
  "checklists": "Full-Stack Development, AI Integration, Biochemistry"
}